{
  "mode": "code-impl",
  "host": "codex",
  "reviewer": "codex",
  "reviewer_model": "gpt-5.4",
  "review_mode": "same-driver",
  "status": "pass",
  "next_action": "stop_passed",
  "manual_intervention_required": false,
  "batch": 1,
  "round": 1,
  "max_rounds": 3,
  "suggested_next_batch": 1,
  "suggested_next_round": 1,
  "blocking_findings": [],
  "scope": {
    "mode": "code-impl",
    "workspace_root": "/tmp/tmp.dcaB90GFRj/workspace",
    "workspace_mode": "isolated",
    "spec_baseline": "plan",
    "plan_path": "docs/superpowers/plans/2026-04-09-execute-change-v2-task-ledger.md",
    "design_path": "docs/superpowers/specs/2026-04-09-execute-change-v2-task-ledger-design.md",
    "design_version": "2026-04-09-initial",
    "allowed_touch_set": [
      "AGENTS.md",
      "README.md",
      "commands/execute-change.md",
      "skills/_harness-libs/contracts.sh",
      "skills/_harness-libs/execute-runner.sh",
      "skills/_harness-libs/phase-engine.sh",
      "skills/_harness-libs/plan-runner.sh",
      "skills/_harness-libs/smoke-test/test-execute-runner.sh",
      "skills/_harness-libs/smoke-test/test-plan-runner.sh",
      "skills/_harness-libs/smoke-test/test-review-execute-command-control.sh",
      "skills/_harness-libs/smoke-test/test-task-ledger.sh",
      "skills/_harness-libs/task-ledger.sh",
      "skills/_review-libs/artifact-dag.sh",
      "skills/_review-libs/run-review.sh",
      "skills/_review-libs/smoke-test/test-artifact-dag.sh",
      "skills/_review-libs/workspace.sh",
      "skills/execute-change/SKILL.md",
      "skills/plan-change/SKILL.md",
      "skills/review-code-impl/SKILL.md",
      "skills/review-code-impl/references/workflow-details.md"
    ],
    "out_of_scope_touched_files": [
      "commands/close-change.md",
      "commands/review-change.md",
      "commands/review-code-impl.md",
      "commands/review-design.md",
      "commands/review-plan.md",
      "commands/sync-truth.md",
      "docs/superpowers/plans/2026-04-09-execute-change-v2-task-ledger.md",
      "docs/superpowers/specs/2026-04-09-execute-change-v2-task-ledger-design.md",
      "skills/_harness-libs/close-runner.sh",
      "skills/_harness-libs/smoke-test/test-close-runner.sh",
      "skills/_harness-libs/smoke-test/test-truth-sync-runner.sh",
      "skills/_harness-libs/truth-sync-runner.sh",
      "skills/analyze-project/SKILL.md",
      "skills/analyze-project/references/output-contract.md",
      "skills/organize-docs/SKILL.md"
    ],
    "files": [
      "AGENTS.md",
      "README.md",
      "commands/execute-change.md",
      "skills/_harness-libs/contracts.sh",
      "skills/_harness-libs/execute-runner.sh",
      "skills/_harness-libs/plan-runner.sh",
      "skills/_harness-libs/smoke-test/test-execute-runner.sh",
      "skills/_harness-libs/smoke-test/test-plan-runner.sh",
      "skills/_harness-libs/smoke-test/test-review-execute-command-control.sh",
      "skills/_harness-libs/smoke-test/test-task-ledger.sh",
      "skills/_harness-libs/task-ledger.sh",
      "skills/_review-libs/artifact-dag.sh",
      "skills/_review-libs/run-review.sh",
      "skills/_review-libs/smoke-test/test-artifact-dag.sh",
      "skills/_review-libs/workspace.sh",
      "skills/execute-change/SKILL.md",
      "skills/plan-change/SKILL.md",
      "skills/review-code-impl/SKILL.md",
      "skills/review-code-impl/references/workflow-details.md"
    ]
  },
  "result": {
    "findings": [],
    "lens": "Security and correctness, Testing and spec compliance, Production readiness",
    "pass_rationale": "Reviewed the design baseline, plan baseline, and all listed implementation/test files. I did not find a Critical issue explicitly present in the reviewed files: no direct security break, data-loss path, crash/panic path, or acceptance-criterion contradiction severe enough to justify FAIL under the requested Critical-only threshold. The task-ledger, execute-runner, artifact-DAG surface matching, and review-workspace fencing all have gaps and limitations, but none rise to Critical severity from the code as written in this reviewed slice.",
    "summary": "PASS. No Critical issues found in the reviewed design/plan/code slice.",
    "verdict": "PASS"
  }
}
